Coding System (ICD-10 Read),Codes,Description,Entity type,Category
ICD-10,I63,Cerebral infarction,res42: cardiovascular disease,diagnostic
ICD-10,I23.8,Other current complications following acute myocardial infarction,res42: cardiovascular disease,diagnostic
ICD-10,I23,Certain current complications following acute myocardial infarction,res42: cardiovascular disease,diagnostic
ICD-10,I23.6,"Thrombosis of atrium, auricular appendage, and ventricle as current complications following acute my",res42: cardiovascular disease,diagnostic
ICD-10,I22.9,Subsequent myocardial infarction of unspecified site,res42: cardiovascular disease,diagnostic
ICD-10,I21,Acute myocardial infarction,res42: cardiovascular disease,diagnostic
ICD-10,I21.3,Acute transmural myocardial infarction of unspecified site,res42: cardiovascular disease,diagnostic
ICD-10,I21.0,Acute transmural myocardial infarction of anterior wall,res42: cardiovascular disease,diagnostic
ICD-10,I22.8,Subsequent myocardial infarction of other sites,res42: cardiovascular disease,diagnostic
ICD-10,I21.1,Acute transmural myocardial infarction of inferior wall,res42: cardiovascular disease,diagnostic
ICD-10,I21.2,Acute transmural myocardial infarction of other sites,res42: cardiovascular disease,diagnostic
ICD-10,I22.1,Subsequent myocardial infarction of inferior wall,res42: cardiovascular disease,diagnostic
ICD-10,I21.4,Acute subendocardial myocardial infarction,res42: cardiovascular disease,diagnostic
ICD-10,I22.0,Subsequent myocardial infarction of anterior wall,res42: cardiovascular disease,diagnostic
ICD-10,I21.9,"Acute myocardial infarction, unspecified",res42: cardiovascular disease,diagnostic
ICD-10,I22,Subsequent myocardial infarction,res42: cardiovascular disease,diagnostic
ICD-10,I23.0,Haemopericardium as current complication following acute myocardial infarction,res42: cardiovascular disease,diagnostic
ICD-10,I23.3,Rupture of cardiac wall without haemopericardium as current complication following acute myocardial ,res42: cardiovascular disease,diagnostic
ICD-10,I23.2,Ventricular septal defect as current complication following acute myocardial infarction,res42: cardiovascular disease,diagnostic
ICD-10,I23.1,Atrial septal defect as current complication following acute myocardial infarction,res42: cardiovascular disease,diagnostic
ICD-10,I23.5,Rupture of papillary muscle as current complication following acute myocardial infarction,res42: cardiovascular disease,diagnostic
ICD-10,I23.4,Rupture of chordae tendineae as current complication following acute myocardial infarction,res42: cardiovascular disease,diagnostic
ICD-10,I63.3,Cerebral infarction due to thrombosis of cerebral arteries,res42: cardiovascular disease,diagnostic
ICD-10,I63.2,Cerebral infarction due to unspecified occlusion or stenosis of precerebral arteries,res42: cardiovascular disease,diagnostic
ICD-10,I63.1,Cerebral infarction due to embolism of precerebral arteries,res42: cardiovascular disease,diagnostic
ICD-10,I63.0,Cerebral infarction due to thrombosis of precerebral arteries,res42: cardiovascular disease,diagnostic
ICD-10,I63.6,"Cerebral infarction due to cerebral venous thrombosis, nonpyogenic",res42: cardiovascular disease,diagnostic
ICD-10,I63.5,Cerebral infarction due to unspecified occlusion or stenosis of cerebral arteries,res42: cardiovascular disease,diagnostic
ICD-10,I63.4,Cerebral infarction due to embolism of cerebral arteries,res42: cardiovascular disease,diagnostic
ICD-10,I64.0,"Stroke, not specified as haemorrhage or infarction",res42: cardiovascular disease,diagnostic
ICD-10,I64,"Stroke, not specified as haemorrhage or infarction",res42: cardiovascular disease,diagnostic
ICD-10,I63.8,Other cerebral infarction,res42: cardiovascular disease,diagnostic
ICD-10,I63.9,"Cerebral infarction, unspecified",res42: cardiovascular disease,diagnostic
Read,G301.00,Other specified anterior myocardial infarction,res42: cardiovascular disease,diagnostic
Read,G384.00,Postoperative subendocardial myocardial infarction,res42: cardiovascular disease,diagnostic
Read,323..00,ECG: myocardial infarction,res42: cardiovascular disease,diagnostic
Read,G30..17,Silent myocardial infarction,res42: cardiovascular disease,diagnostic
Read,323Z.00,ECG: myocardial infarct NOS,res42: cardiovascular disease,diagnostic
Read,G30..13,Cardiac rupture following myocardial infarction (MI),res42: cardiovascular disease,diagnostic
Read,G30..15,MI - acute myocardial infarction,res42: cardiovascular disease,diagnostic
Read,G30..12,Coronary thrombosis,res42: cardiovascular disease,diagnostic
Read,G30..00,Acute myocardial infarction,res42: cardiovascular disease,diagnostic
Read,G30X.00,Acute transmural myocardial infarction of unspecif site,res42: cardiovascular disease,diagnostic
Read,G305.00,Lateral myocardial infarction NOS,res42: cardiovascular disease,diagnostic
Read,G381.00,Postoperative transmural myocardial infarction inferior wall,res42: cardiovascular disease,diagnostic
Read,G304.00,Posterior myocardial infarction NOS,res42: cardiovascular disease,diagnostic
Read,G301z00,Anterior myocardial infarction NOS,res42: cardiovascular disease,diagnostic
Read,G30B.00,Acute posterolateral myocardial infarction,res42: cardiovascular disease,diagnostic
Read,G308.00,Inferior myocardial infarction NOS,res42: cardiovascular disease,diagnostic
Read,G307100,Acute non-ST segment elevation myocardial infarction,res42: cardiovascular disease,diagnostic
Read,G306.00,True posterior myocardial infarction,res42: cardiovascular disease,diagnostic
Read,G350.00,Subsequent myocardial infarction of anterior wall,res42: cardiovascular disease,diagnostic
Read,G30y.00,Other acute myocardial infarction,res42: cardiovascular disease,diagnostic
Read,G30X000,Acute ST segment elevation myocardial infarction,res42: cardiovascular disease,diagnostic
Read,G380.00,Postoperative transmural myocardial infarction anterior wall,res42: cardiovascular disease,diagnostic
Read,G35..00,Subsequent myocardial infarction,res42: cardiovascular disease,diagnostic
Read,G30z.00,Acute myocardial infarction NOS,res42: cardiovascular disease,diagnostic
Read,G30yz00,Other acute myocardial infarction NOS,res42: cardiovascular disease,diagnostic
Read,G311500,Acute coronary syndrome,res42: cardiovascular disease,diagnostic
Read,G311000,Myocardial infarction aborted,res42: cardiovascular disease,diagnostic
Read,G311011,MI - myocardial infarction aborted,res42: cardiovascular disease,diagnostic
Read,G351.00,Subsequent myocardial infarction of inferior wall,res42: cardiovascular disease,diagnostic
Read,G38..00,Postoperative myocardial infarction,res42: cardiovascular disease,diagnostic
Read,G35X.00,Subsequent myocardial infarction of unspecified site,res42: cardiovascular disease,diagnostic
Read,G353.00,Subsequent myocardial infarction of other sites,res42: cardiovascular disease,diagnostic
Read,G61..12,Stroke due to intracerebral haemorrhage,res42: cardiovascular disease,diagnostic
Read,G38z.00,"Postoperative myocardial infarction, unspecified",res42: cardiovascular disease,diagnostic
Read,G64..13,Stroke due to cerebral arterial occlusion,res42: cardiovascular disease,diagnostic
Read,G66..00,Stroke and cerebrovascular accident unspecified,res42: cardiovascular disease,diagnostic
Read,Gyu3400,[X]Acute transmural myocardial infarction of unspecif site,res42: cardiovascular disease,diagnostic
Read,G66..12,Stroke unspecified,res42: cardiovascular disease,diagnostic
